{"apiVersion":"assent.dev/v1alpha1","kind":"ComparisonRecord","baselineProfile":"prod-strict@6","candidateProfile":"prod-strict@7","caseId":"score-threshold-change-accepted","deltas":[{"kind":"score-threshold-change","rule":"soft-bump","subject":"topic-registry:orders.events.v1","obligation":"signal","baseline":{"present":true,"decision":"REVIEW","effect":"comment","points":2},"candidate":{"present":true,"decision":"APPROVE","effect":"comment","points":1}}]}