{"apiVersion":"assent.dev/v1alpha1","kind":"ComparisonRecord","baselineProfile":"prod-strict@6","candidateProfile":"prod-strict@7","caseId":"named-consumer-compat-widen-accepted","deltas":[{"kind":"newly-auto-mergeable","rule":"non-destructive","subject":"topic-registry:orders.events.v1","obligation":"non-destructive","baseline":{"present":true,"decision":"BLOCK","effect":"block"},"candidate":{"present":false,"decision":"APPROVE"}}]}