{"apiVersion":"assent.dev/v1alpha1","kind":"ComparisonRecord","baselineProfile":"prod-strict@6","candidateProfile":"prod-strict@7","caseId":"partition-shrink-wording-only","deltas":[{"kind":"explanation-only","rule":"non-destructive","subject":"topic-registry:orders.events.v1","obligation":"non-destructive","baseline":{"present":true,"decision":"BLOCK","effect":"block"},"candidate":{"present":true,"decision":"BLOCK","effect":"block"}}]}