{"apiVersion":"assent.dev/v1alpha1","kind":"ComparisonRecord","baselineProfile":"prod-strict@6","candidateProfile":"prod-strict@7","caseId":"challenge-intervention-added","deltas":[{"kind":"stricter-intervention-added","rule":"retention-ack","subject":"topic-registry:orders.events.v1","obligation":"retention-ack","baseline":{"present":false,"decision":"APPROVE"},"candidate":{"present":true,"decision":"REVIEW","effect":"challenge"}}]}